{
  "record_type": "evaluation_certificate",
  "evaluation_certificate_id": "eval_synthetic_001",
  "evaluator_id": "synthetic_holdout_evaluator",
  "holdout_independence": true,
  "contamination_status": "pass",
  "leakage_budget": {
    "lower": 0.0,
    "upper": 0.01,
    "unit": "fraction"
  },
  "elicitation_envelope": [
    "bounded synthetic tasks"
  ],
  "capability_floor": {
    "lower": 0.75,
    "upper": 0.95,
    "unit": "success_fraction"
  },
  "dangerous_capability_ceiling": {
    "lower": 0.0,
    "upper": 0.1,
    "unit": "risk_score"
  },
  "target_coordinate_statuses": [
    {
      "coordinate": "synthetic_code_repair",
      "status": "accepted",
      "within_boundary": true
    },
    {
      "coordinate": "synthetic_unregistered_target",
      "status": "abstained_or_uncertified",
      "within_boundary": false
    }
  ],
  "abstention_conditions": [
    "outside evaluator boundary"
  ]
}
